{
  "schema_version": "generation_job.v1",
  "job_id": "job_qwen_to_face_detailer_chain_example",
  "character_id": "character_anna_novari_example",
  "fan_id": null,
  "request_id": "request_chain_smoke_example",
  "job_type": "quality_check",
  "content_tier": "sfw",
  "priority": 60,
  "status": "queued",
  "workflow": {
    "name": "Qwen to Face Detailer Chain",
    "adapter": "Qwen to Face Detailer Chain",
    "profile": "chain_qwen_face_detailer",
    "input_mode": "image_to_image",
    "chain": [
      "Qwen Image Edit Smoke",
      "Face Detailer Smoke"
    ]
  },
  "inputs": {
    "positive_prompt": "cinematic portrait, soft studio light, consistent face, realistic skin",
    "negative_prompt": "low quality, distorted face, extra limbs, watermark",
    "seed": 12345,
    "width": 512,
    "height": 512,
    "batch_size": 1
  },
  "output": {
    "filename_prefix": "fanvue_direct_chain",
    "storage_target": "local_debug",
    "expected_files": 2
  },
  "callback": {
    "enabled": false,
    "url_env": null,
    "auth_header_env": null,
    "auth_value_env": null,
    "fails_job": false
  },
  "runtime": {
    "provider": "runpod",
    "image": "ghcr.io/leo-aiteam/fanvue-comfy-runtime:latest",
    "disk_gb": 120,
    "gpu_count": 1,
    "gpu_type": "NVIDIA L40S",
    "stop_policy": "always",
    "timeout_seconds": 3600
  },
  "metadata": {
    "purpose": "direct_gpu_validated_image_chain",
    "last_validated_at": "2026-06-15",
    "qwen_prompt_id": "ebdc9872-b683-45c5-bd83-843c8b9917eb",
    "face_detailer_prompt_id": "014744d4-5c4e-45f6-a787-0b496032ef57"
  }
}
