{
  "schema_version": "generation_job.v1",
  "job_id": "job_anna_v2_pulid_flux_ref001_calibration",
  "character_id": "character_anna_novari_v2_calibration",
  "fan_id": null,
  "request_id": "request_anna_v2_pulid_flux_ref001_calibration",
  "job_type": "face_variations",
  "content_tier": "sfw",
  "priority": 50,
  "status": "queued",
  "workflow": {
    "name": "Anna v2 PuLID Flux ref001 calibration",
    "profile": "anna_v2_pulid_flux_ref001",
    "adapter": "Anna v2 PuLID Flux ref001 calibration",
    "input_mode": "image_to_image"
  },
  "inputs": {
    "positive_prompt": "Anna v2 single-reference Flux PuLID identity calibration from synthetic reference 001, adult woman, natural phone-photo realism, changed pose and expression, compact softly rounded chin, sharp eyes, natural skin texture",
    "negative_prompt": "different person, long pointed chin, generic blonde model, blurred face, plastic skin, waxy skin, teen-coded, glamour studio look, duplicate of reference composition",
    "seed": 202607101701,
    "prompt_files": [
      "api_prompts/anna_v2_pulid_flux_ref001_001_home_3q.json",
      "api_prompts/anna_v2_pulid_flux_ref001_002_window_side.json",
      "api_prompts/anna_v2_pulid_flux_ref001_003_bed_down_gaze.json"
    ],
    "requires_input_images": [
      {
        "local_hint": "Anna v2 face passport shortlist 001",
        "comfy_image": "fanvue/runtime/001_ref_full.png"
      }
    ]
  },
  "output": {
    "filename_prefix": "anna_v2_pulid_flux_ref001_calibration",
    "storage_target": "local_debug",
    "expected_files": 3
  },
  "callback": {
    "enabled": false,
    "url_env": null,
    "auth_header_env": null,
    "auth_value_env": null,
    "fails_job": false
  },
  "runtime": {
    "provider": "runpod",
    "image": "ghcr.io/leo-aiteam/fanvue-comfy-runtime:latest",
    "disk_gb": 120,
    "gpu_count": 1,
    "gpu_type": "NVIDIA L40S",
    "stop_policy": "manual_debug",
    "timeout_seconds": 3600
  },
  "metadata": {
    "version": "1.0.0",
    "manual_review_required": true,
    "prompt_files": [
      "api_prompts/anna_v2_pulid_flux_ref001_001_home_3q.json",
      "api_prompts/anna_v2_pulid_flux_ref001_002_window_side.json",
      "api_prompts/anna_v2_pulid_flux_ref001_003_bed_down_gaze.json"
    ],
    "requires_input_images": [
      {
        "local_hint": "Anna v2 face passport shortlist 001",
        "comfy_image": "fanvue/runtime/001_ref_full.png"
      }
    ],
    "generation": {
      "purpose": "single-reference Anna v2 identity calibration with Flux PuLID pose variation",
      "explicitness": "SFW",
    "reference_policy": "use synthetic reference 001 as identity source only",
    "acceptance": [
      "not a duplicate of 001 composition",
      "same face family and compact softly rounded chin",
      "sharp eyes and natural phone-photo skin",
      "no teen-coded result",
      "no plastic, waxy, or overly beauty-filtered skin"
    ],
    "reject_if": [
      "different person",
      "long or pointed chin",
      "generic blonde model face",
      "blurred face",
      "glamour studio look"
    ]
    }
  }
}
