{
  "schema_version": "generation_job.v1",
  "job_id": "job_video_lifestyle_adult_v1_example",
  "character_id": "character_anna_novari_example",
  "fan_id": null,
  "request_id": "request_video_lifestyle_adult_v1_example",
  "job_type": "video",
  "content_tier": "teasing",
  "priority": 70,
  "status": "paused",
  "workflow": {
    "name": "Video Lifestyle Adult v1",
    "adapter": "Video Lifestyle Adult v1",
    "profile": "video_lifestyle_adult_v1",
    "input_mode": "text_to_video"
  },
  "inputs": {
    "positive_prompt": "photorealistic lifestyle video, natural movement, realistic skin texture, cinematic lighting",
    "negative_prompt": "low quality, flicker, distorted anatomy, extra limbs, watermark, text, logo",
    "seed": 12345,
    "width": 768,
    "height": 1024,
    "batch_size": 1
  },
  "output": {
    "filename_prefix": "fanvue_video_lifestyle_adult_v1",
    "storage_target": "external",
    "expected_files": 1
  },
  "callback": {
    "enabled": false,
    "url_env": null,
    "auth_header_env": null,
    "auth_value_env": null,
    "fails_job": false
  },
  "runtime": {
    "provider": "runpod",
    "image": "ghcr.io/leo-aiteam/fanvue-comfy-runtime:latest",
    "disk_gb": 160,
    "gpu_count": 1,
    "gpu_type": "NVIDIA L40S",
    "stop_policy": "manual_debug",
    "timeout_seconds": 5400
  },
  "metadata": {
    "purpose": "registered_video_profile_manual_hold",
    "safety": "requires_video_gpu_smoke_before_queue_enable",
    "model_profile": "video_lifestyle_adult_v1"
  }
}
